{
  "$schema": "../../../../../../tools/World/SourceIngestion/contracts/source-profile.schema.json",
  "schema_version": 1,
  "profile_id": "synthetic_landscape_water_twin",
  "network_budget_bytes": 0,
  "area": {
    "area_id": "synthetic_landscape_water_twin",
    "label": "Synthetic Landscape and water twin",
    "bbox": [-0.1, -0.1, 1.4, 0.7],
    "axis_order": "longitude_latitude",
    "crs": "EPSG:4326"
  },
  "sources": [
    {
      "source_id": "synthetic_landscape_water_twin_v1",
      "adapter": "synthetic_json",
      "provider": "ALIS synthetic fixture",
      "dataset": "synthetic-landscape-water-twin",
      "release": "1",
      "local_path": "../../Fixtures/Provider/synthetic_landscape_water_twin/synthetic_provider.json",
      "file_name": "synthetic_provider.json",
      "expected_bytes": 3974,
      "hashes": {"sha256": "8e64ae54d03339ec9ba301898693b0bec4c569c4ec06d2ff75c6995c10be18a9"},
      "coverage_bbox": [-0.1, -0.1, 1.4, 0.7],
      "crs": {"horizontal": "EPSG:4326", "axis_order": "longitude_latitude", "vertical": "EPSG:3855", "vertical_unit": "metre"},
      "accuracy": {"horizontal_accuracy_m": 0.0, "vertical_accuracy_m": 0.0, "confidence": "fixture_exact"},
      "license": {"id": "CC0-1.0", "attribution": "ALIS"},
      "admission": {
        "policy_result": "approved",
        "commercial_transformation": true,
        "generated_artifact_publication": "approved",
        "acquisition": "repository_fixture"
      }
    }
  ]
}
